/home/ka/ka_itec/ka_rh5993/.local/lib/python3.12/site-packages/pydantic/_internal/_generate_schema.py:2249: UnsupportedFieldAttributeWarning: The 'repr' attribute with value False was provided to the `Field()` function, which has no effect in the context it was used. 'repr' is field-specific metadata, and can only be attached to a model field using `Annotated` metadata or by assignment. This may have happened because an `Annotated` type alias using the `type` statement was used, or if the `Field()` function was attached to a single member of a union type.
  warnings.warn(
/home/ka/ka_itec/ka_rh5993/.local/lib/python3.12/site-packages/pydantic/_internal/_generate_schema.py:2249: UnsupportedFieldAttributeWarning: The 'frozen' attribute with value True was provided to the `Field()` function, which has no effect in the context it was used. 'frozen' is field-specific metadata, and can only be attached to a model field using `Annotated` metadata or by assignment. This may have happened because an `Annotated` type alias using the `type` statement was used, or if the `Field()` function was attached to a single member of a union type.
  warnings.warn(
2025-11-14 09:09:44,703 INFO: Loading dataset from ./data/dataset.ds
2025-11-14 09:09:44,749 INFO: Using accelerator=cpu
2025-11-14 09:09:44,749 INFO: === Starting run 1/4 with seed 42 ===
GPU available: False, used: False
TPU available: False, using: 0 TPU cores
HPU available: False, using: 0 HPUs
wandb: Currently logged in as: lupos to https://api.wandb.ai. Use `wandb login --relogin` to force relogin
wandb: setting up run 6vpcccfp
wandb: Tracking run with wandb version 0.22.2
wandb: Run data is saved locally in /scratch/ka_rh5993/wandb_logs/wandb/run-20251114_090945-6vpcccfp
wandb: Run `wandb offline` to turn off syncing.
wandb: Syncing run RSNN_wHypOpt_8L_Skip4_run1
wandb: ⭐️ View project at https://wandb.ai/lupos/surrogate-confidence
wandb: 🚀 View run at https://wandb.ai/lupos/surrogate-confidence/runs/6vpcccfp
/home/ka/ka_itec/ka_rh5993/.local/lib/python3.12/site-packages/pytorch_lightning/callbacks/model_checkpoint.py:751: Checkpoint directory /pfs/data6/home/ka/ka_itec/ka_rh5993/SpikeSynth/surrogate/models/SRNN exists and is not empty.

  | Name             | Type       | Params | Mode 
--------------------------------------------------------
0 | norm             | LayerNorm  | 14     | train
1 | lif_layers       | ModuleList | 62.9 K | train
2 | leaky_linears    | ModuleList | 0      | train
3 | temp_skip_projs  | ModuleList | 0      | train
4 | layer_skip_projs | ModuleList | 16.6 K | train
5 | layer_bntt       | ModuleList | 0      | train
6 | layer_norms      | ModuleList | 0      | train
7 | output_layer     | Linear     | 65     | train
--------------------------------------------------------
46.9 K    Trainable params
32.8 K    Non-trainable params
79.6 K    Total params
0.319     Total estimated model params size (MB)
36        Modules in train mode
0         Modules in eval mode
SLURM auto-requeueing enabled. Setting signal handlers.
Metric val_loss improved. New best score: 0.148
Metric val_loss improved by 0.013 >= min_delta = 0.0001. New best score: 0.135
Metric val_loss improved by 0.015 >= min_delta = 0.0001. New best score: 0.120
Metric val_loss improved by 0.004 >= min_delta = 0.0001. New best score: 0.116
Metric val_loss improved by 0.002 >= min_delta = 0.0001. New best score: 0.114
Metric val_loss improved by 0.001 >= min_delta = 0.0001. New best score: 0.113
Metric val_loss improved by 0.003 >= min_delta = 0.0001. New best score: 0.110
Metric val_loss improved by 0.001 >= min_delta = 0.0001. New best score: 0.109
Metric val_loss improved by 0.001 >= min_delta = 0.0001. New best score: 0.107
Metric val_loss improved by 0.001 >= min_delta = 0.0001. New best score: 0.106
Metric val_loss improved by 0.000 >= min_delta = 0.0001. New best score: 0.106
Metric val_loss improved by 0.000 >= min_delta = 0.0001. New best score: 0.105
Metric val_loss improved by 0.002 >= min_delta = 0.0001. New best score: 0.103
Metric val_loss improved by 0.000 >= min_delta = 0.0001. New best score: 0.103
Metric val_loss improved by 0.001 >= min_delta = 0.0001. New best score: 0.102
Metric val_loss improved by 0.000 >= min_delta = 0.0001. New best score: 0.102
Metric val_loss improved by 0.000 >= min_delta = 0.0001. New best score: 0.101
Metric val_loss improved by 0.001 >= min_delta = 0.0001. New best score: 0.100
Metric val_loss improved by 0.001 >= min_delta = 0.0001. New best score: 0.099
Metric val_loss improved by 0.001 >= min_delta = 0.0001. New best score: 0.098
Metric val_loss improved by 0.003 >= min_delta = 0.0001. New best score: 0.095
Metric val_loss improved by 0.001 >= min_delta = 0.0001. New best score: 0.094
Metric val_loss improved by 0.000 >= min_delta = 0.0001. New best score: 0.094
Metric val_loss improved by 0.001 >= min_delta = 0.0001. New best score: 0.093
Metric val_loss improved by 0.001 >= min_delta = 0.0001. New best score: 0.091
Metric val_loss improved by 0.001 >= min_delta = 0.0001. New best score: 0.091
Metric val_loss improved by 0.000 >= min_delta = 0.0001. New best score: 0.091
Metric val_loss improved by 0.001 >= min_delta = 0.0001. New best score: 0.090
Metric val_loss improved by 0.001 >= min_delta = 0.0001. New best score: 0.089
Metric val_loss improved by 0.001 >= min_delta = 0.0001. New best score: 0.089
Metric val_loss improved by 0.001 >= min_delta = 0.0001. New best score: 0.088
Metric val_loss improved by 0.001 >= min_delta = 0.0001. New best score: 0.087
Metric val_loss improved by 0.000 >= min_delta = 0.0001. New best score: 0.087
`Trainer.fit` stopped: `max_epochs=80` reached.
wandb: uploading artifact model-6vpcccfp; updating run metadata
wandb: uploading artifact model-6vpcccfp
wandb: 
wandb: Run history:
wandb:                        epoch ▁▁▁▂▂▂▂▂▂▂▃▃▄▄▄▄▄▄▄▄▅▅▅▅▅▅▅▆▆▆▆▇▇▇▇▇▇███
wandb: grad_mean/layer_skip_projs.4 ▇▂▃▂▁▃▂▁▁▁▂▁▄▁▁▁▁▁▁▁▂▂▂▁▂▁▁▂▂▂▂▃█▅▄▅▅▃▄▃
wandb: grad_mean/layer_skip_projs.5 ▅▃▅▂▃▅▁▂▂▁▂▂▂▂▂▂▁▁▃▁▃▁▂▄▁▃▁▃▃▂▃▃▃▄█▅▃▃▃▂
wandb: grad_mean/layer_skip_projs.6 █▆▃▄▃▃▂▃▄▃▃▁▃▂▂▁▂▂▁▁▂▁▁▂▂▃▃▁▃▃▃▂▃▂▄▇▃▃▃▄
wandb: grad_mean/layer_skip_projs.7 ▂▂▂▁▁▂▂▁▁█▁▁▁▃▂▂▂▂▃▃▃▂▂▂▂▂▃▂▂▄▃▃▃▃▂▁▃▂▄▁
wandb:       grad_mean/lif_layers.0 ▁▁▁▃▂▁▂▄▃▁▂▃▂▃▁▃▄▂▃▁▁▅▃▄▃▅▃▅▃▆▂█▂▄▆▃▂▃▂▂
wandb:       grad_mean/lif_layers.1 ▃▁▃▂▃▂▂▃▄▁▃▁▂▁▃▂▇▁▂▁▃▇▂▄▄▅▄▆█▄▇▁▃▂▂▂▃▃▂▂
wandb:       grad_mean/lif_layers.2 ▁▂▁▃▂▂▂▁▂▂▃█▁▂▁▂▂▃▂▁▁▂▃▁▂▄▂▂▄▃▁▁▂▁▂▁▂▂▁▂
wandb:       grad_mean/lif_layers.3 ▁▁▂▂▂▂▁▂▁▁▂▁▂█▂▁▁▁▁▂▂▂▂▃▂▂▂▂▂▁▁▂▂▁▁▁▁▂▂▁
wandb:       grad_mean/lif_layers.4 █▃▂▂▂▃▂▁▂▃▂▂▁▁▁▁▁▁▁▁▁▁▂▁▁▁▁▃▁▃▂▂▂▂▅▄▄▄▃▃
wandb:                          +16 ...
wandb: 
wandb: Run summary:
wandb:                        epoch 79
wandb: grad_mean/layer_skip_projs.4 1e-05
wandb: grad_mean/layer_skip_projs.5 1e-05
wandb: grad_mean/layer_skip_projs.6 2e-05
wandb: grad_mean/layer_skip_projs.7 0.00012
wandb:       grad_mean/lif_layers.0 0.00051
wandb:       grad_mean/lif_layers.1 0.00022
wandb:       grad_mean/lif_layers.2 0.00013
wandb:       grad_mean/lif_layers.3 9e-05
wandb:       grad_mean/lif_layers.4 2e-05
wandb:                          +16 ...
wandb: 
wandb: 🚀 View run RSNN_wHypOpt_8L_Skip4_run1 at: https://wandb.ai/lupos/surrogate-confidence/runs/6vpcccfp
wandb: ⭐️ View project at: https://wandb.ai/lupos/surrogate-confidence
wandb: Synced 6 W&B file(s), 0 media file(s), 2 artifact file(s) and 0 other file(s)
wandb: Find logs at: /scratch/ka_rh5993/wandb_logs/wandb/run-20251114_090945-6vpcccfp/logs
2025-11-14 09:55:12,769 INFO: Run 1 finished. Best checkpoint: /pfs/data6/home/ka/ka_itec/ka_rh5993/SpikeSynth/surrogate/models/SRNN/RSNN_wHypOpt_8L_Skip4-runrun_idx=0-epoch=74-val_loss=0.09.ckpt
2025-11-14 09:55:12,769 INFO: === Starting run 2/4 with seed 43 ===
GPU available: False, used: False
TPU available: False, using: 0 TPU cores
HPU available: False, using: 0 HPUs
wandb: setting up run 831l7f3o
wandb: Tracking run with wandb version 0.22.2
wandb: Run data is saved locally in /scratch/ka_rh5993/wandb_logs/wandb/run-20251114_095512-831l7f3o
wandb: Run `wandb offline` to turn off syncing.
wandb: Syncing run RSNN_wHypOpt_8L_Skip4_run2
wandb: ⭐️ View project at https://wandb.ai/lupos/surrogate-confidence
wandb: 🚀 View run at https://wandb.ai/lupos/surrogate-confidence/runs/831l7f3o
/home/ka/ka_itec/ka_rh5993/.local/lib/python3.12/site-packages/pytorch_lightning/callbacks/model_checkpoint.py:751: Checkpoint directory /pfs/data6/home/ka/ka_itec/ka_rh5993/SpikeSynth/surrogate/models/SRNN exists and is not empty.

  | Name             | Type       | Params | Mode 
--------------------------------------------------------
0 | norm             | LayerNorm  | 14     | train
1 | lif_layers       | ModuleList | 62.9 K | train
2 | leaky_linears    | ModuleList | 0      | train
3 | temp_skip_projs  | ModuleList | 0      | train
4 | layer_skip_projs | ModuleList | 16.6 K | train
5 | layer_bntt       | ModuleList | 0      | train
6 | layer_norms      | ModuleList | 0      | train
7 | output_layer     | Linear     | 65     | train
--------------------------------------------------------
46.9 K    Trainable params
32.8 K    Non-trainable params
79.6 K    Total params
0.319     Total estimated model params size (MB)
36        Modules in train mode
0         Modules in eval mode
SLURM auto-requeueing enabled. Setting signal handlers.
Metric val_loss improved. New best score: 0.136
Metric val_loss improved by 0.013 >= min_delta = 0.0001. New best score: 0.124
Metric val_loss improved by 0.004 >= min_delta = 0.0001. New best score: 0.120
Metric val_loss improved by 0.005 >= min_delta = 0.0001. New best score: 0.115
Metric val_loss improved by 0.001 >= min_delta = 0.0001. New best score: 0.114
Metric val_loss improved by 0.001 >= min_delta = 0.0001. New best score: 0.113
Metric val_loss improved by 0.001 >= min_delta = 0.0001. New best score: 0.112
Metric val_loss improved by 0.001 >= min_delta = 0.0001. New best score: 0.110
Metric val_loss improved by 0.001 >= min_delta = 0.0001. New best score: 0.109
Metric val_loss improved by 0.001 >= min_delta = 0.0001. New best score: 0.109
Metric val_loss improved by 0.001 >= min_delta = 0.0001. New best score: 0.108
Metric val_loss improved by 0.001 >= min_delta = 0.0001. New best score: 0.108
Metric val_loss improved by 0.001 >= min_delta = 0.0001. New best score: 0.107
Metric val_loss improved by 0.000 >= min_delta = 0.0001. New best score: 0.107
Metric val_loss improved by 0.000 >= min_delta = 0.0001. New best score: 0.106
Metric val_loss improved by 0.001 >= min_delta = 0.0001. New best score: 0.105
Metric val_loss improved by 0.000 >= min_delta = 0.0001. New best score: 0.105
Metric val_loss improved by 0.001 >= min_delta = 0.0001. New best score: 0.104
Metric val_loss improved by 0.001 >= min_delta = 0.0001. New best score: 0.103
Metric val_loss improved by 0.000 >= min_delta = 0.0001. New best score: 0.103
Metric val_loss improved by 0.001 >= min_delta = 0.0001. New best score: 0.102
Metric val_loss improved by 0.001 >= min_delta = 0.0001. New best score: 0.100
Metric val_loss improved by 0.000 >= min_delta = 0.0001. New best score: 0.100
Metric val_loss improved by 0.001 >= min_delta = 0.0001. New best score: 0.099
Metric val_loss improved by 0.002 >= min_delta = 0.0001. New best score: 0.098
Metric val_loss improved by 0.001 >= min_delta = 0.0001. New best score: 0.097
Metric val_loss improved by 0.003 >= min_delta = 0.0001. New best score: 0.095
Metric val_loss improved by 0.001 >= min_delta = 0.0001. New best score: 0.093
Metric val_loss improved by 0.002 >= min_delta = 0.0001. New best score: 0.091
Metric val_loss improved by 0.001 >= min_delta = 0.0001. New best score: 0.090
Metric val_loss improved by 0.001 >= min_delta = 0.0001. New best score: 0.089
Metric val_loss improved by 0.001 >= min_delta = 0.0001. New best score: 0.089
Metric val_loss improved by 0.000 >= min_delta = 0.0001. New best score: 0.088
Metric val_loss improved by 0.000 >= min_delta = 0.0001. New best score: 0.088
`Trainer.fit` stopped: `max_epochs=80` reached.
wandb: uploading history steps 277-279, summary, console lines 56-56
wandb: 
wandb: Run history:
wandb:                        epoch ▁▁▂▂▂▂▂▃▃▃▃▃▃▃▃▄▄▄▄▄▄▅▅▅▅▅▅▅▅▆▆▇▇▇▇▇▇▇██
wandb: grad_mean/layer_skip_projs.4 █▂▂▂▂▂▃▄▂▂▁▁▁▁▁▁▁▁▁▁▂▂▂▂▁▂▁▁▂▁▂▁▂▁▁▁▁▂▁▂
wandb: grad_mean/layer_skip_projs.5 █▃▂▄▃▄▂▁▁▂▂▂▂▁▁▂▁▂▁▃▁▂▁▁▁▃▁▁▁▁▁▁▁▁▁▁▁▁▁▁
wandb: grad_mean/layer_skip_projs.6 ▂▃▁▂▂▂█▂▃▂▂▃▃▂▂▁▂▃▂▃▁▁▁▂▂▂▂▂▁▁▂▁▁▁▁▁▁▁▂▁
wandb: grad_mean/layer_skip_projs.7 ▁▂▂▂▁▂▁▁▁█▂▂▁▂▂▁▁▂▂▁▂▂▁▁▂▁▃▁▅▄▂▁▁▁▄▂▂▂▃▁
wandb:       grad_mean/lif_layers.0 ▂▃▂▁▂▃▂▃▅▁▁▃▁▁▂▂▃▃▂▂▇▃▆▄█▅▃▆▂▂▃▆▂▂▅▄▂▂▂▁
wandb:       grad_mean/lif_layers.1 ▃▂▁▂▂▁▃▁▁▁▁▁▁▁▁▁▁▁▂▃▂▂▂▃▂▅▂▂█▇▂▂▅▃▂▁▃▁▁▂
wandb:       grad_mean/lif_layers.2 ▆▃▁▂▃▂▅▄▄▂▅▂▂▁▁▂▁▂▃▂▁▂▂▂▂▂▂▂▂▂▅▂█▂▃▁▂▂▁▁
wandb:       grad_mean/lif_layers.3 ▆▂▂▃▂█▂▄▂▇▃▄▅▂▁▁▂▃▂▂▂▁▁▃▃▇▆▆▂▃▄▂▂▃▂▂▁▁▂▁
wandb:       grad_mean/lif_layers.4 █▆▂▃▁▂▂▂▂▂▂▂▂▁▁▁▁▁▁▁▂▁▂▁▁▁▁▂▁▁▁▂▁▁▁▁▁▁▁▁
wandb:                          +16 ...
wandb: 
wandb: Run summary:
wandb:                        epoch 79
wandb: grad_mean/layer_skip_projs.4 1e-05
wandb: grad_mean/layer_skip_projs.5 1e-05
wandb: grad_mean/layer_skip_projs.6 3e-05
wandb: grad_mean/layer_skip_projs.7 0.00017
wandb:       grad_mean/lif_layers.0 0.00038
wandb:       grad_mean/lif_layers.1 0.00014
wandb:       grad_mean/lif_layers.2 0.00011
wandb:       grad_mean/lif_layers.3 7e-05
wandb:       grad_mean/lif_layers.4 1e-05
wandb:                          +16 ...
wandb: 
wandb: 🚀 View run RSNN_wHypOpt_8L_Skip4_run2 at: https://wandb.ai/lupos/surrogate-confidence/runs/831l7f3o
wandb: ⭐️ View project at: https://wandb.ai/lupos/surrogate-confidence
wandb: Synced 6 W&B file(s), 0 media file(s), 0 artifact file(s) and 0 other file(s)
wandb: Find logs at: /scratch/ka_rh5993/wandb_logs/wandb/run-20251114_095512-831l7f3o/logs
2025-11-14 10:40:26,486 INFO: Run 2 finished. Best checkpoint: /pfs/data6/home/ka/ka_itec/ka_rh5993/SpikeSynth/surrogate/models/SRNN/RSNN_wHypOpt_8L_Skip4-runrun_idx=0-epoch=74-val_loss=0.09.ckpt
2025-11-14 10:40:26,487 INFO: === Starting run 3/4 with seed 44 ===
GPU available: False, used: False
TPU available: False, using: 0 TPU cores
HPU available: False, using: 0 HPUs
wandb: setting up run wo5qhtme
wandb: Tracking run with wandb version 0.22.2
wandb: Run data is saved locally in /scratch/ka_rh5993/wandb_logs/wandb/run-20251114_104026-wo5qhtme
wandb: Run `wandb offline` to turn off syncing.
wandb: Syncing run RSNN_wHypOpt_8L_Skip4_run3
wandb: ⭐️ View project at https://wandb.ai/lupos/surrogate-confidence
wandb: 🚀 View run at https://wandb.ai/lupos/surrogate-confidence/runs/wo5qhtme
/home/ka/ka_itec/ka_rh5993/.local/lib/python3.12/site-packages/pytorch_lightning/callbacks/model_checkpoint.py:751: Checkpoint directory /pfs/data6/home/ka/ka_itec/ka_rh5993/SpikeSynth/surrogate/models/SRNN exists and is not empty.

  | Name             | Type       | Params | Mode 
--------------------------------------------------------
0 | norm             | LayerNorm  | 14     | train
1 | lif_layers       | ModuleList | 62.9 K | train
2 | leaky_linears    | ModuleList | 0      | train
3 | temp_skip_projs  | ModuleList | 0      | train
4 | layer_skip_projs | ModuleList | 16.6 K | train
5 | layer_bntt       | ModuleList | 0      | train
6 | layer_norms      | ModuleList | 0      | train
7 | output_layer     | Linear     | 65     | train
--------------------------------------------------------
46.9 K    Trainable params
32.8 K    Non-trainable params
79.6 K    Total params
0.319     Total estimated model params size (MB)
36        Modules in train mode
0         Modules in eval mode
SLURM auto-requeueing enabled. Setting signal handlers.
Metric val_loss improved. New best score: 0.151
Metric val_loss improved by 0.023 >= min_delta = 0.0001. New best score: 0.129
Metric val_loss improved by 0.002 >= min_delta = 0.0001. New best score: 0.127
Metric val_loss improved by 0.005 >= min_delta = 0.0001. New best score: 0.122
Metric val_loss improved by 0.001 >= min_delta = 0.0001. New best score: 0.121
Metric val_loss improved by 0.006 >= min_delta = 0.0001. New best score: 0.116
Metric val_loss improved by 0.001 >= min_delta = 0.0001. New best score: 0.115
Metric val_loss improved by 0.001 >= min_delta = 0.0001. New best score: 0.114
Metric val_loss improved by 0.001 >= min_delta = 0.0001. New best score: 0.113
Metric val_loss improved by 0.001 >= min_delta = 0.0001. New best score: 0.112
Metric val_loss improved by 0.001 >= min_delta = 0.0001. New best score: 0.111
Metric val_loss improved by 0.001 >= min_delta = 0.0001. New best score: 0.111
Metric val_loss improved by 0.002 >= min_delta = 0.0001. New best score: 0.109
Metric val_loss improved by 0.001 >= min_delta = 0.0001. New best score: 0.108
Metric val_loss improved by 0.000 >= min_delta = 0.0001. New best score: 0.108
Metric val_loss improved by 0.000 >= min_delta = 0.0001. New best score: 0.108
Metric val_loss improved by 0.001 >= min_delta = 0.0001. New best score: 0.107
Metric val_loss improved by 0.001 >= min_delta = 0.0001. New best score: 0.106
Metric val_loss improved by 0.001 >= min_delta = 0.0001. New best score: 0.106
Metric val_loss improved by 0.000 >= min_delta = 0.0001. New best score: 0.106
Metric val_loss improved by 0.000 >= min_delta = 0.0001. New best score: 0.105
Metric val_loss improved by 0.000 >= min_delta = 0.0001. New best score: 0.105
Metric val_loss improved by 0.001 >= min_delta = 0.0001. New best score: 0.104
Metric val_loss improved by 0.000 >= min_delta = 0.0001. New best score: 0.104
Metric val_loss improved by 0.001 >= min_delta = 0.0001. New best score: 0.103
Metric val_loss improved by 0.001 >= min_delta = 0.0001. New best score: 0.102
Metric val_loss improved by 0.002 >= min_delta = 0.0001. New best score: 0.099
Metric val_loss improved by 0.002 >= min_delta = 0.0001. New best score: 0.097
Metric val_loss improved by 0.001 >= min_delta = 0.0001. New best score: 0.096
Metric val_loss improved by 0.000 >= min_delta = 0.0001. New best score: 0.096
Metric val_loss improved by 0.001 >= min_delta = 0.0001. New best score: 0.095
Metric val_loss improved by 0.003 >= min_delta = 0.0001. New best score: 0.092
Metric val_loss improved by 0.001 >= min_delta = 0.0001. New best score: 0.090
Metric val_loss improved by 0.001 >= min_delta = 0.0001. New best score: 0.090
Metric val_loss improved by 0.001 >= min_delta = 0.0001. New best score: 0.089
Metric val_loss improved by 0.000 >= min_delta = 0.0001. New best score: 0.089
Metric val_loss improved by 0.001 >= min_delta = 0.0001. New best score: 0.087
Metric val_loss improved by 0.001 >= min_delta = 0.0001. New best score: 0.087
Metric val_loss improved by 0.000 >= min_delta = 0.0001. New best score: 0.087
Metric val_loss improved by 0.000 >= min_delta = 0.0001. New best score: 0.087
`Trainer.fit` stopped: `max_epochs=80` reached.
wandb: uploading artifact model-wo5qhtme; updating run metadata
wandb: uploading artifact model-wo5qhtme
wandb: 
wandb: Run history:
wandb:                        epoch ▁▁▁▁▂▃▃▃▃▃▄▄▄▄▄▅▅▅▅▅▅▅▆▆▆▆▆▆▆▇▇▇▇▇██████
wandb: grad_mean/layer_skip_projs.4 █▂▁▂▁▂▁▁▁▂▂▁▁▁▁▂▂▁▁▁▁▂▁▁▁▂▃▂▁▂▂▁▁▂▁▁▁▁▁▁
wandb: grad_mean/layer_skip_projs.5 █▂▂▃▂▂▁▁▂▂▁▂▁▁▂▂▁▁▂▁▁▂▁▁▁▁▁▁▂▁▁▁▁▁▁▁▁▁▁▁
wandb: grad_mean/layer_skip_projs.6 ▆▅▃▄▅▃▅█▅▂▂█▂▂▂▂▃▁▂▆▅▂▂▂▁▃▁▁▃▁▂▁▃▄▁▂▂▄▁▁
wandb: grad_mean/layer_skip_projs.7 ▅▃▃▃▄▂█▂▁▂▂▂▃▄▃▁▁▁▂▁▅▂▁▆▁▃▂▃▂▂▂▂▁▂▄▁▁▄▂▁
wandb:       grad_mean/lif_layers.0 ▂▁▁▁▁▂▁▁▂▁▂▁▁▁▁▁▁▁▁▂▃▂▁▂█▂▄▂▇▃▂▂▂▂▂▃▁▂▁▂
wandb:       grad_mean/lif_layers.1 ▅▄▄▂▂▃▂▂▄▂▂▅▂▂▁▂▃▃▄▄▆▃▅▆▃▃▃▂█▇▄▇▇▂▄▂▃▃▃▄
wandb:       grad_mean/lif_layers.2 ▆▇▂▄▅▃▅▄▂█▃▃▃▅▂▅▂▂▁▂▁▃▅▂▃▇▃▄▂▆▄▃▂▃▃▂▃▃▁▃
wandb:       grad_mean/lif_layers.3 ▃▅▃▃▃▃█▃▂▂▁▁▁▂▃▁▂▁▂▁▂▂▄▂▃▂▄▄▁▄▃▅▂▁▁▃▃▂▂▁
wandb:       grad_mean/lif_layers.4 ▃▅▃▃▂▄▄▃█▄▄▇▁▂▃▃▃▃▂▂▂▂▃▂▅▅▃▃▃▆▂▃▃▃▃▂▂▂▃▂
wandb:                          +16 ...
wandb: 
wandb: Run summary:
wandb:                        epoch 79
wandb: grad_mean/layer_skip_projs.4 0.0
wandb: grad_mean/layer_skip_projs.5 1e-05
wandb: grad_mean/layer_skip_projs.6 2e-05
wandb: grad_mean/layer_skip_projs.7 0.00014
wandb:       grad_mean/lif_layers.0 0.00073
wandb:       grad_mean/lif_layers.1 0.00028
wandb:       grad_mean/lif_layers.2 0.00014
wandb:       grad_mean/lif_layers.3 8e-05
wandb:       grad_mean/lif_layers.4 1e-05
wandb:                          +16 ...
wandb: 
wandb: 🚀 View run RSNN_wHypOpt_8L_Skip4_run3 at: https://wandb.ai/lupos/surrogate-confidence/runs/wo5qhtme
wandb: ⭐️ View project at: https://wandb.ai/lupos/surrogate-confidence
wandb: Synced 6 W&B file(s), 0 media file(s), 2 artifact file(s) and 0 other file(s)
wandb: Find logs at: /scratch/ka_rh5993/wandb_logs/wandb/run-20251114_104026-wo5qhtme/logs
2025-11-14 11:25:23,852 INFO: Run 3 finished. Best checkpoint: /pfs/data6/home/ka/ka_itec/ka_rh5993/SpikeSynth/surrogate/models/SRNN/RSNN_wHypOpt_8L_Skip4-runrun_idx=0-epoch=78-val_loss=0.09.ckpt
2025-11-14 11:25:23,852 INFO: === Starting run 4/4 with seed 45 ===
GPU available: False, used: False
TPU available: False, using: 0 TPU cores
HPU available: False, using: 0 HPUs
wandb: setting up run xjk9yftp
wandb: Tracking run with wandb version 0.22.2
wandb: Run data is saved locally in /scratch/ka_rh5993/wandb_logs/wandb/run-20251114_112523-xjk9yftp
wandb: Run `wandb offline` to turn off syncing.
wandb: Syncing run RSNN_wHypOpt_8L_Skip4_run4
wandb: ⭐️ View project at https://wandb.ai/lupos/surrogate-confidence
wandb: 🚀 View run at https://wandb.ai/lupos/surrogate-confidence/runs/xjk9yftp
/home/ka/ka_itec/ka_rh5993/.local/lib/python3.12/site-packages/pytorch_lightning/callbacks/model_checkpoint.py:751: Checkpoint directory /pfs/data6/home/ka/ka_itec/ka_rh5993/SpikeSynth/surrogate/models/SRNN exists and is not empty.

  | Name             | Type       | Params | Mode 
--------------------------------------------------------
0 | norm             | LayerNorm  | 14     | train
1 | lif_layers       | ModuleList | 62.9 K | train
2 | leaky_linears    | ModuleList | 0      | train
3 | temp_skip_projs  | ModuleList | 0      | train
4 | layer_skip_projs | ModuleList | 16.6 K | train
5 | layer_bntt       | ModuleList | 0      | train
6 | layer_norms      | ModuleList | 0      | train
7 | output_layer     | Linear     | 65     | train
--------------------------------------------------------
46.9 K    Trainable params
32.8 K    Non-trainable params
79.6 K    Total params
0.319     Total estimated model params size (MB)
36        Modules in train mode
0         Modules in eval mode
SLURM auto-requeueing enabled. Setting signal handlers.
Metric val_loss improved. New best score: 0.136
Metric val_loss improved by 0.013 >= min_delta = 0.0001. New best score: 0.122
Metric val_loss improved by 0.005 >= min_delta = 0.0001. New best score: 0.117
Metric val_loss improved by 0.001 >= min_delta = 0.0001. New best score: 0.116
Metric val_loss improved by 0.003 >= min_delta = 0.0001. New best score: 0.113
Metric val_loss improved by 0.003 >= min_delta = 0.0001. New best score: 0.111
Metric val_loss improved by 0.001 >= min_delta = 0.0001. New best score: 0.110
Metric val_loss improved by 0.001 >= min_delta = 0.0001. New best score: 0.108
Metric val_loss improved by 0.000 >= min_delta = 0.0001. New best score: 0.108
Metric val_loss improved by 0.001 >= min_delta = 0.0001. New best score: 0.108
Metric val_loss improved by 0.000 >= min_delta = 0.0001. New best score: 0.107
Metric val_loss improved by 0.000 >= min_delta = 0.0001. New best score: 0.107
Metric val_loss improved by 0.001 >= min_delta = 0.0001. New best score: 0.106
Metric val_loss improved by 0.000 >= min_delta = 0.0001. New best score: 0.106
Metric val_loss improved by 0.000 >= min_delta = 0.0001. New best score: 0.106
Metric val_loss improved by 0.001 >= min_delta = 0.0001. New best score: 0.105
Metric val_loss improved by 0.001 >= min_delta = 0.0001. New best score: 0.105
Metric val_loss improved by 0.001 >= min_delta = 0.0001. New best score: 0.104
Metric val_loss improved by 0.000 >= min_delta = 0.0001. New best score: 0.103
Metric val_loss improved by 0.000 >= min_delta = 0.0001. New best score: 0.103
Metric val_loss improved by 0.001 >= min_delta = 0.0001. New best score: 0.102
Metric val_loss improved by 0.000 >= min_delta = 0.0001. New best score: 0.102
Metric val_loss improved by 0.001 >= min_delta = 0.0001. New best score: 0.101
Metric val_loss improved by 0.000 >= min_delta = 0.0001. New best score: 0.101
Metric val_loss improved by 0.000 >= min_delta = 0.0001. New best score: 0.101
Metric val_loss improved by 0.001 >= min_delta = 0.0001. New best score: 0.100
Metric val_loss improved by 0.001 >= min_delta = 0.0001. New best score: 0.099
Metric val_loss improved by 0.000 >= min_delta = 0.0001. New best score: 0.098
Metric val_loss improved by 0.001 >= min_delta = 0.0001. New best score: 0.097
Metric val_loss improved by 0.000 >= min_delta = 0.0001. New best score: 0.097
Metric val_loss improved by 0.000 >= min_delta = 0.0001. New best score: 0.096
Metric val_loss improved by 0.000 >= min_delta = 0.0001. New best score: 0.096
Metric val_loss improved by 0.000 >= min_delta = 0.0001. New best score: 0.096
Metric val_loss improved by 0.000 >= min_delta = 0.0001. New best score: 0.095
Metric val_loss improved by 0.000 >= min_delta = 0.0001. New best score: 0.095
Metric val_loss improved by 0.000 >= min_delta = 0.0001. New best score: 0.095
`Trainer.fit` stopped: `max_epochs=80` reached.
wandb: updating run metadata
wandb: 
wandb: Run history:
wandb:                        epoch ▁▁▁▁▂▂▂▃▃▃▃▃▃▄▄▄▄▄▄▅▅▅▅▆▆▆▆▆▆▆▇▇▇▇▇█████
wandb: grad_mean/layer_skip_projs.4 ▇▃▂▁▅▄▇▄▂▄▂▄▄▅▅▄▃▁▃▁▂▁▁▂▂▁▂▂▄▃▂▄▂▃▅▇▅█▄▄
wandb: grad_mean/layer_skip_projs.5 ▄▃▅▂▁▂▃▃▃▃▄▁▂▂▃▃▃▃▁▂▁▃▃▂▁▂▂▁▁▁▁▂▂▂▃█▅▄▄▄
wandb: grad_mean/layer_skip_projs.6 ▁▃▃▂▁▂▁▂▂▃▁▃▃▃▁▁▂▃▂▂▂▁▁▁▂▂▂▁▂▁▂▂▁▁▂▇█▃▅▄
wandb: grad_mean/layer_skip_projs.7 █▁▂▃▂▂▂▃▂▂▂▁▂▂▃▂▁▂▂▁▁▁▁▁▂▂▁▃▁▄▂▂▁▂▂▃▄▂▂▁
wandb:       grad_mean/lif_layers.0 █▂▂▁▁▁▁▁▁▁▁▁▂▂▂▂▁▁▁▂▁▁▃▂▂▅▄▆▁▁▂▄▂▂▃▃▂▂▁▂
wandb:       grad_mean/lif_layers.1 █▁▁▃▃▃▁▂▁▁▁▁▁▁▁▂▂▂▁▁▁▁▁▂▁▁▁▁▂▃▁▃▃▃▂▂▂▂▁▂
wandb:       grad_mean/lif_layers.2 █▂▁▂▃▁▁▁▂▁▁▂▁▁▂▁▁▁▁▁▁▁▁▁▁▁▁▂▁▁▁▂▁▂▂▁▁▁▂▁
wandb:       grad_mean/lif_layers.3 █▄█▃▄▅▄▃▃▄▆▄▃▃▆▂▂▄▃▃▂▁▁▁▂▁▂▃▂▄▃▂▅▂▃▆▄▃▂▂
wandb:       grad_mean/lif_layers.4 ▂▂█▂▃▁▂▂▂▃▁▃▃▃▂▁▃▂▁▁▁▁▁▂▂▂▂▂▃▃▂▃▃▃▄▅▄▂▃▃
wandb:                          +16 ...
wandb: 
wandb: Run summary:
wandb:                        epoch 79
wandb: grad_mean/layer_skip_projs.4 1e-05
wandb: grad_mean/layer_skip_projs.5 2e-05
wandb: grad_mean/layer_skip_projs.6 5e-05
wandb: grad_mean/layer_skip_projs.7 9e-05
wandb:       grad_mean/lif_layers.0 0.00042
wandb:       grad_mean/lif_layers.1 0.00016
wandb:       grad_mean/lif_layers.2 0.00011
wandb:       grad_mean/lif_layers.3 0.0001
wandb:       grad_mean/lif_layers.4 1e-05
wandb:                          +16 ...
wandb: 
wandb: 🚀 View run RSNN_wHypOpt_8L_Skip4_run4 at: https://wandb.ai/lupos/surrogate-confidence/runs/xjk9yftp
wandb: ⭐️ View project at: https://wandb.ai/lupos/surrogate-confidence
wandb: Synced 6 W&B file(s), 0 media file(s), 0 artifact file(s) and 0 other file(s)
wandb: Find logs at: /scratch/ka_rh5993/wandb_logs/wandb/run-20251114_112523-xjk9yftp/logs
2025-11-14 12:10:15,922 INFO: Run 4 finished. Best checkpoint: /pfs/data6/home/ka/ka_itec/ka_rh5993/SpikeSynth/surrogate/models/SRNN/RSNN_wHypOpt_8L_Skip4-runrun_idx=0-epoch=78-val_loss=0.09.ckpt
