/home/ka/ka_itec/ka_rh5993/.local/lib/python3.12/site-packages/pydantic/_internal/_generate_schema.py:2249: UnsupportedFieldAttributeWarning: The 'repr' attribute with value False was provided to the `Field()` function, which has no effect in the context it was used. 'repr' is field-specific metadata, and can only be attached to a model field using `Annotated` metadata or by assignment. This may have happened because an `Annotated` type alias using the `type` statement was used, or if the `Field()` function was attached to a single member of a union type.
  warnings.warn(
/home/ka/ka_itec/ka_rh5993/.local/lib/python3.12/site-packages/pydantic/_internal/_generate_schema.py:2249: UnsupportedFieldAttributeWarning: The 'frozen' attribute with value True was provided to the `Field()` function, which has no effect in the context it was used. 'frozen' is field-specific metadata, and can only be attached to a model field using `Annotated` metadata or by assignment. This may have happened because an `Annotated` type alias using the `type` statement was used, or if the `Field()` function was attached to a single member of a union type.
  warnings.warn(
2025-11-14 09:08:58,903 INFO: Loading dataset from ./data/dataset.ds
2025-11-14 09:08:59,098 INFO: Using accelerator=cpu
2025-11-14 09:08:59,098 INFO: === Starting run 1/4 with seed 42 ===
GPU available: False, used: False
TPU available: False, using: 0 TPU cores
HPU available: False, using: 0 HPUs
wandb: Currently logged in as: lupos to https://api.wandb.ai. Use `wandb login --relogin` to force relogin
wandb: setting up run rea7a210
wandb: Tracking run with wandb version 0.22.2
wandb: Run data is saved locally in /scratch/ka_rh5993/wandb_logs/wandb/run-20251114_090859-rea7a210
wandb: Run `wandb offline` to turn off syncing.
wandb: Syncing run RSNN_wHypOpt_8L_Skip2_run1
wandb: ⭐️ View project at https://wandb.ai/lupos/surrogate-confidence
wandb: 🚀 View run at https://wandb.ai/lupos/surrogate-confidence/runs/rea7a210
/home/ka/ka_itec/ka_rh5993/.local/lib/python3.12/site-packages/pytorch_lightning/callbacks/model_checkpoint.py:751: Checkpoint directory /pfs/data6/home/ka/ka_itec/ka_rh5993/SpikeSynth/surrogate/models/SRNN exists and is not empty.

  | Name             | Type       | Params | Mode 
--------------------------------------------------------
0 | norm             | LayerNorm  | 14     | train
1 | lif_layers       | ModuleList | 62.9 K | train
2 | leaky_linears    | ModuleList | 0      | train
3 | temp_skip_projs  | ModuleList | 0      | train
4 | layer_skip_projs | ModuleList | 25.0 K | train
5 | layer_bntt       | ModuleList | 0      | train
6 | layer_norms      | ModuleList | 0      | train
7 | output_layer     | Linear     | 65     | train
--------------------------------------------------------
55.2 K    Trainable params
32.8 K    Non-trainable params
88.0 K    Total params
0.352     Total estimated model params size (MB)
38        Modules in train mode
0         Modules in eval mode
SLURM auto-requeueing enabled. Setting signal handlers.
Metric val_loss improved. New best score: 0.159
Metric val_loss improved by 0.001 >= min_delta = 0.0001. New best score: 0.159
Metric val_loss improved by 0.000 >= min_delta = 0.0001. New best score: 0.158
Metric val_loss improved by 0.003 >= min_delta = 0.0001. New best score: 0.156
Metric val_loss improved by 0.009 >= min_delta = 0.0001. New best score: 0.147
Metric val_loss improved by 0.019 >= min_delta = 0.0001. New best score: 0.128
Metric val_loss improved by 0.007 >= min_delta = 0.0001. New best score: 0.120
Metric val_loss improved by 0.002 >= min_delta = 0.0001. New best score: 0.118
Metric val_loss improved by 0.005 >= min_delta = 0.0001. New best score: 0.114
Metric val_loss improved by 0.002 >= min_delta = 0.0001. New best score: 0.112
Metric val_loss improved by 0.001 >= min_delta = 0.0001. New best score: 0.111
Metric val_loss improved by 0.001 >= min_delta = 0.0001. New best score: 0.110
Metric val_loss improved by 0.000 >= min_delta = 0.0001. New best score: 0.110
Metric val_loss improved by 0.002 >= min_delta = 0.0001. New best score: 0.108
Metric val_loss improved by 0.001 >= min_delta = 0.0001. New best score: 0.107
Metric val_loss improved by 0.000 >= min_delta = 0.0001. New best score: 0.107
Metric val_loss improved by 0.000 >= min_delta = 0.0001. New best score: 0.106
Metric val_loss improved by 0.000 >= min_delta = 0.0001. New best score: 0.106
Metric val_loss improved by 0.000 >= min_delta = 0.0001. New best score: 0.106
Metric val_loss improved by 0.000 >= min_delta = 0.0001. New best score: 0.106
Metric val_loss improved by 0.000 >= min_delta = 0.0001. New best score: 0.105
Metric val_loss improved by 0.001 >= min_delta = 0.0001. New best score: 0.104
Metric val_loss improved by 0.001 >= min_delta = 0.0001. New best score: 0.104
Metric val_loss improved by 0.005 >= min_delta = 0.0001. New best score: 0.099
Metric val_loss improved by 0.009 >= min_delta = 0.0001. New best score: 0.090
Metric val_loss improved by 0.005 >= min_delta = 0.0001. New best score: 0.084
Metric val_loss improved by 0.002 >= min_delta = 0.0001. New best score: 0.082
Metric val_loss improved by 0.003 >= min_delta = 0.0001. New best score: 0.079
Metric val_loss improved by 0.002 >= min_delta = 0.0001. New best score: 0.077
Metric val_loss improved by 0.001 >= min_delta = 0.0001. New best score: 0.076
Metric val_loss improved by 0.001 >= min_delta = 0.0001. New best score: 0.075
Metric val_loss improved by 0.000 >= min_delta = 0.0001. New best score: 0.075
Metric val_loss improved by 0.001 >= min_delta = 0.0001. New best score: 0.074
Metric val_loss improved by 0.000 >= min_delta = 0.0001. New best score: 0.074
Metric val_loss improved by 0.000 >= min_delta = 0.0001. New best score: 0.073
Metric val_loss improved by 0.000 >= min_delta = 0.0001. New best score: 0.073
Metric val_loss improved by 0.000 >= min_delta = 0.0001. New best score: 0.073
Metric val_loss improved by 0.000 >= min_delta = 0.0001. New best score: 0.073
`Trainer.fit` stopped: `max_epochs=80` reached.
wandb: uploading artifact model-rea7a210; updating run metadata
wandb: uploading artifact model-rea7a210
wandb: 
wandb: Run history:
wandb:                        epoch ▁▁▁▂▂▂▂▂▂▃▃▃▄▄▄▄▄▄▄▄▄▅▅▅▅▅▅▅▅▅▆▆▆▆▆▇▇▇██
wandb: grad_mean/layer_skip_projs.2 ▁▁▁▂▁▂▂▁▂▃▂▃▂▁▁▁▁▁▁▂▅█▄▃▃▂▂▂▁▁▁▁▂▁▂▁▁▁▁▁
wandb: grad_mean/layer_skip_projs.3 ▂▁▁▁▁▃▂▃▂▂▂▄▂▁▁▁▁▂▂▅█▃▂▂▂▂▂▁▂▁▁▁▂▁▁▂▁▁▁▁
wandb: grad_mean/layer_skip_projs.4 ▁▁▁▁▁▁▂▁▂▁▁▁▁▁▁▁▁▁▁▃▂▂▂█▂▁▁▁▁▁▁▁▁▁▁▁▁▁▁▁
wandb: grad_mean/layer_skip_projs.5 ▂▂▂▂▂▁▂▁▂▂▁▁▁▁▁▂▁▁▂▁▂▄█▃▄▂▁▄▁▂▁▂▁▁▁▁▁▁▁▁
wandb: grad_mean/layer_skip_projs.6 ▁▃▁▃▂▂▂▁▁▁▂▁▂▁▂▁▁▁▃▇▂█▂▂▁▁▁▁▁▁▁▁▁▁▁▁▁▁▁▁
wandb: grad_mean/layer_skip_projs.7 ▇▂▇▃▃▃▂▃▃▂▂▁▁▂▂▂▂▄▂▂█▄▄▄▅▄▁▃▅▂▃▃▂▁▃▅▂▂▁▂
wandb:       grad_mean/lif_layers.0 ▂▁▃▄▄▂▂▃▂▃▂▃▂▂▂▂▄▂▆▄▃█▆▂▂▂▂▂▃▂▂▁▁▂▁▁▁▂▂▁
wandb:       grad_mean/lif_layers.1 ▂▁▁▅█▂▃▃▄▃▅▄▂▂▃▂▂▃▂▂▇▇▅▄▃▂▃▂▂▂▂▃▂▂▂▂▂▂▂▂
wandb:       grad_mean/lif_layers.2 ▂▁▂▂▂▂▂▃▃▂▃▁▁▁▂▁▃▆▆▅▄▃█▂▃▂▂▂▂▃▂▂▂▂▂▂▂▂▂▁
wandb:                          +18 ...
wandb: 
wandb: Run summary:
wandb:                        epoch 79
wandb: grad_mean/layer_skip_projs.2 3e-05
wandb: grad_mean/layer_skip_projs.3 2e-05
wandb: grad_mean/layer_skip_projs.4 2e-05
wandb: grad_mean/layer_skip_projs.5 4e-05
wandb: grad_mean/layer_skip_projs.6 2e-05
wandb: grad_mean/layer_skip_projs.7 9e-05
wandb:       grad_mean/lif_layers.0 9e-05
wandb:       grad_mean/lif_layers.1 6e-05
wandb:       grad_mean/lif_layers.2 3e-05
wandb:                          +18 ...
wandb: 
wandb: 🚀 View run RSNN_wHypOpt_8L_Skip2_run1 at: https://wandb.ai/lupos/surrogate-confidence/runs/rea7a210
wandb: ⭐️ View project at: https://wandb.ai/lupos/surrogate-confidence
wandb: Synced 6 W&B file(s), 0 media file(s), 2 artifact file(s) and 0 other file(s)
wandb: Find logs at: /scratch/ka_rh5993/wandb_logs/wandb/run-20251114_090859-rea7a210/logs
2025-11-14 10:00:05,955 INFO: Run 1 finished. Best checkpoint: /pfs/data6/home/ka/ka_itec/ka_rh5993/SpikeSynth/surrogate/models/SRNN/RSNN_wHypOpt_8L_Skip2-runrun_idx=0-epoch=78-val_loss=0.07.ckpt
2025-11-14 10:00:05,955 INFO: === Starting run 2/4 with seed 43 ===
GPU available: False, used: False
TPU available: False, using: 0 TPU cores
HPU available: False, using: 0 HPUs
wandb: setting up run wvaomcuy
wandb: Tracking run with wandb version 0.22.2
wandb: Run data is saved locally in /scratch/ka_rh5993/wandb_logs/wandb/run-20251114_100005-wvaomcuy
wandb: Run `wandb offline` to turn off syncing.
wandb: Syncing run RSNN_wHypOpt_8L_Skip2_run2
wandb: ⭐️ View project at https://wandb.ai/lupos/surrogate-confidence
wandb: 🚀 View run at https://wandb.ai/lupos/surrogate-confidence/runs/wvaomcuy
/home/ka/ka_itec/ka_rh5993/.local/lib/python3.12/site-packages/pytorch_lightning/callbacks/model_checkpoint.py:751: Checkpoint directory /pfs/data6/home/ka/ka_itec/ka_rh5993/SpikeSynth/surrogate/models/SRNN exists and is not empty.

  | Name             | Type       | Params | Mode 
--------------------------------------------------------
0 | norm             | LayerNorm  | 14     | train
1 | lif_layers       | ModuleList | 62.9 K | train
2 | leaky_linears    | ModuleList | 0      | train
3 | temp_skip_projs  | ModuleList | 0      | train
4 | layer_skip_projs | ModuleList | 25.0 K | train
5 | layer_bntt       | ModuleList | 0      | train
6 | layer_norms      | ModuleList | 0      | train
7 | output_layer     | Linear     | 65     | train
--------------------------------------------------------
55.2 K    Trainable params
32.8 K    Non-trainable params
88.0 K    Total params
0.352     Total estimated model params size (MB)
38        Modules in train mode
0         Modules in eval mode
SLURM auto-requeueing enabled. Setting signal handlers.
Metric val_loss improved. New best score: 0.159
Metric val_loss improved by 0.015 >= min_delta = 0.0001. New best score: 0.144
Metric val_loss improved by 0.020 >= min_delta = 0.0001. New best score: 0.124
Metric val_loss improved by 0.001 >= min_delta = 0.0001. New best score: 0.123
Metric val_loss improved by 0.003 >= min_delta = 0.0001. New best score: 0.120
Metric val_loss improved by 0.002 >= min_delta = 0.0001. New best score: 0.118
Metric val_loss improved by 0.002 >= min_delta = 0.0001. New best score: 0.116
Metric val_loss improved by 0.003 >= min_delta = 0.0001. New best score: 0.113
Metric val_loss improved by 0.001 >= min_delta = 0.0001. New best score: 0.112
Metric val_loss improved by 0.002 >= min_delta = 0.0001. New best score: 0.110
Metric val_loss improved by 0.001 >= min_delta = 0.0001. New best score: 0.109
Metric val_loss improved by 0.001 >= min_delta = 0.0001. New best score: 0.108
Metric val_loss improved by 0.001 >= min_delta = 0.0001. New best score: 0.107
Metric val_loss improved by 0.001 >= min_delta = 0.0001. New best score: 0.106
Metric val_loss improved by 0.001 >= min_delta = 0.0001. New best score: 0.105
Metric val_loss improved by 0.009 >= min_delta = 0.0001. New best score: 0.096
Metric val_loss improved by 0.005 >= min_delta = 0.0001. New best score: 0.091
Metric val_loss improved by 0.007 >= min_delta = 0.0001. New best score: 0.084
Metric val_loss improved by 0.002 >= min_delta = 0.0001. New best score: 0.082
Metric val_loss improved by 0.001 >= min_delta = 0.0001. New best score: 0.081
Metric val_loss improved by 0.002 >= min_delta = 0.0001. New best score: 0.079
Metric val_loss improved by 0.001 >= min_delta = 0.0001. New best score: 0.078
Metric val_loss improved by 0.001 >= min_delta = 0.0001. New best score: 0.077
Metric val_loss improved by 0.000 >= min_delta = 0.0001. New best score: 0.076
Metric val_loss improved by 0.000 >= min_delta = 0.0001. New best score: 0.076
Metric val_loss improved by 0.001 >= min_delta = 0.0001. New best score: 0.075
Metric val_loss improved by 0.000 >= min_delta = 0.0001. New best score: 0.075
Metric val_loss improved by 0.001 >= min_delta = 0.0001. New best score: 0.074
Metric val_loss improved by 0.000 >= min_delta = 0.0001. New best score: 0.073
Metric val_loss improved by 0.000 >= min_delta = 0.0001. New best score: 0.073
Metric val_loss improved by 0.000 >= min_delta = 0.0001. New best score: 0.073
`Trainer.fit` stopped: `max_epochs=80` reached.
wandb: updating run metadata
wandb: uploading history steps 277-279, summary, console lines 21-21
wandb: 
wandb: Run history:
wandb:                        epoch ▁▁▁▁▂▂▂▂▃▃▃▃▃▃▄▄▄▄▄▅▅▅▅▅▅▆▆▆▆▆▇▇▇▇▇▇▇███
wandb: grad_mean/layer_skip_projs.2 ▂▃▁▁▂▂▂▁▂▁▂▁▄▂█▁▄▂▁█▅▄▂▂▁▂▁▂▂▂▂▁▁▁▁▁▁▁▁▁
wandb: grad_mean/layer_skip_projs.3 ▂▂▄▂▁▁▁▁▁▃█▃▇▂▁▇▂▂▁▃▂▃▂▂▁▂▁▂▁▁▂▁▁▁▁▁▁▁▁▁
wandb: grad_mean/layer_skip_projs.4 ▅▃█▄▅▆▃▄▂▃▅▂▄▄▃▂█▄▄▅▂▃▂▂█▂▁▂▂▁▃▂▂▂▂▁▁▂▂▁
wandb: grad_mean/layer_skip_projs.5 ▅▃█▅▃▂▃▂▄▂▂▂▂▃▆▂▄▇█▃▂▂▃▃▂▃▂▆▂▁▃▂▁▂▂▁▁▁▁▁
wandb: grad_mean/layer_skip_projs.6 ▁▁▁▁▂▂▁▁▁▁▁▂▁▂▁█▂▁▁▅▁▁▁▁▁▂▁▁▁▁▁▁▁▁▁▁▁▁▁▁
wandb: grad_mean/layer_skip_projs.7 ▆▂▂▂▂▂▃▃▂▂▃▂█▅▇▂▂▇▂▂▂▁▂▂▂▂▂▁▂▂▂▂▁▁▁▂▂▂▁▁
wandb:       grad_mean/lif_layers.0 ▂▁▂▃▁▁▁▁▂▃▅█▂▂▂▄▂▁▁▁▂▁▂▂▂▂▁▂▁▁▁▂▁▁▁▁▁▁▁▁
wandb:       grad_mean/lif_layers.1 ▁▂▂▂▂▄▂▁▁▂▂▁▁▂▂▅▅▂▃▃▁▂▆█▂▁▁▂▂▁▂▂▂▂▁▂▂▁▂▁
wandb:       grad_mean/lif_layers.2 ▂▃▃▂▃▁▂▂▂▂▁▃▆▂▃█▆▂▂▂▂▂▃▂▂▂▂▂▂▂▂▂▁▁▂▁▁▁▁▁
wandb:                          +18 ...
wandb: 
wandb: Run summary:
wandb:                        epoch 79
wandb: grad_mean/layer_skip_projs.2 3e-05
wandb: grad_mean/layer_skip_projs.3 3e-05
wandb: grad_mean/layer_skip_projs.4 2e-05
wandb: grad_mean/layer_skip_projs.5 3e-05
wandb: grad_mean/layer_skip_projs.6 2e-05
wandb: grad_mean/layer_skip_projs.7 7e-05
wandb:       grad_mean/lif_layers.0 0.00013
wandb:       grad_mean/lif_layers.1 8e-05
wandb:       grad_mean/lif_layers.2 4e-05
wandb:                          +18 ...
wandb: 
wandb: 🚀 View run RSNN_wHypOpt_8L_Skip2_run2 at: https://wandb.ai/lupos/surrogate-confidence/runs/wvaomcuy
wandb: ⭐️ View project at: https://wandb.ai/lupos/surrogate-confidence
wandb: Synced 6 W&B file(s), 0 media file(s), 0 artifact file(s) and 0 other file(s)
wandb: Find logs at: /scratch/ka_rh5993/wandb_logs/wandb/run-20251114_100005-wvaomcuy/logs
2025-11-14 10:51:27,278 INFO: Run 2 finished. Best checkpoint: /pfs/data6/home/ka/ka_itec/ka_rh5993/SpikeSynth/surrogate/models/SRNN/RSNN_wHypOpt_8L_Skip2-runrun_idx=0-epoch=78-val_loss=0.07.ckpt
2025-11-14 10:51:27,278 INFO: === Starting run 3/4 with seed 44 ===
GPU available: False, used: False
TPU available: False, using: 0 TPU cores
HPU available: False, using: 0 HPUs
wandb: setting up run 3obe0pd7
wandb: Tracking run with wandb version 0.22.2
wandb: Run data is saved locally in /scratch/ka_rh5993/wandb_logs/wandb/run-20251114_105127-3obe0pd7
wandb: Run `wandb offline` to turn off syncing.
wandb: Syncing run RSNN_wHypOpt_8L_Skip2_run3
wandb: ⭐️ View project at https://wandb.ai/lupos/surrogate-confidence
wandb: 🚀 View run at https://wandb.ai/lupos/surrogate-confidence/runs/3obe0pd7
/home/ka/ka_itec/ka_rh5993/.local/lib/python3.12/site-packages/pytorch_lightning/callbacks/model_checkpoint.py:751: Checkpoint directory /pfs/data6/home/ka/ka_itec/ka_rh5993/SpikeSynth/surrogate/models/SRNN exists and is not empty.

  | Name             | Type       | Params | Mode 
--------------------------------------------------------
0 | norm             | LayerNorm  | 14     | train
1 | lif_layers       | ModuleList | 62.9 K | train
2 | leaky_linears    | ModuleList | 0      | train
3 | temp_skip_projs  | ModuleList | 0      | train
4 | layer_skip_projs | ModuleList | 25.0 K | train
5 | layer_bntt       | ModuleList | 0      | train
6 | layer_norms      | ModuleList | 0      | train
7 | output_layer     | Linear     | 65     | train
--------------------------------------------------------
55.2 K    Trainable params
32.8 K    Non-trainable params
88.0 K    Total params
0.352     Total estimated model params size (MB)
38        Modules in train mode
0         Modules in eval mode
SLURM auto-requeueing enabled. Setting signal handlers.
Metric val_loss improved. New best score: 0.155
Metric val_loss improved by 0.009 >= min_delta = 0.0001. New best score: 0.146
Metric val_loss improved by 0.007 >= min_delta = 0.0001. New best score: 0.139
Metric val_loss improved by 0.015 >= min_delta = 0.0001. New best score: 0.124
Metric val_loss improved by 0.006 >= min_delta = 0.0001. New best score: 0.118
Metric val_loss improved by 0.003 >= min_delta = 0.0001. New best score: 0.115
Metric val_loss improved by 0.001 >= min_delta = 0.0001. New best score: 0.113
Metric val_loss improved by 0.002 >= min_delta = 0.0001. New best score: 0.112
Metric val_loss improved by 0.000 >= min_delta = 0.0001. New best score: 0.111
Metric val_loss improved by 0.001 >= min_delta = 0.0001. New best score: 0.110
Metric val_loss improved by 0.000 >= min_delta = 0.0001. New best score: 0.109
Metric val_loss improved by 0.001 >= min_delta = 0.0001. New best score: 0.109
Metric val_loss improved by 0.001 >= min_delta = 0.0001. New best score: 0.108
Metric val_loss improved by 0.001 >= min_delta = 0.0001. New best score: 0.107
Metric val_loss improved by 0.000 >= min_delta = 0.0001. New best score: 0.106
Metric val_loss improved by 0.001 >= min_delta = 0.0001. New best score: 0.106
Metric val_loss improved by 0.000 >= min_delta = 0.0001. New best score: 0.105
Metric val_loss improved by 0.001 >= min_delta = 0.0001. New best score: 0.104
Metric val_loss improved by 0.000 >= min_delta = 0.0001. New best score: 0.104
Metric val_loss improved by 0.001 >= min_delta = 0.0001. New best score: 0.103
Metric val_loss improved by 0.001 >= min_delta = 0.0001. New best score: 0.101
Metric val_loss improved by 0.002 >= min_delta = 0.0001. New best score: 0.100
Metric val_loss improved by 0.000 >= min_delta = 0.0001. New best score: 0.099
Metric val_loss improved by 0.002 >= min_delta = 0.0001. New best score: 0.098
Metric val_loss improved by 0.000 >= min_delta = 0.0001. New best score: 0.097
Metric val_loss improved by 0.001 >= min_delta = 0.0001. New best score: 0.097
Metric val_loss improved by 0.001 >= min_delta = 0.0001. New best score: 0.096
Metric val_loss improved by 0.003 >= min_delta = 0.0001. New best score: 0.093
Metric val_loss improved by 0.001 >= min_delta = 0.0001. New best score: 0.092
Metric val_loss improved by 0.001 >= min_delta = 0.0001. New best score: 0.091
Metric val_loss improved by 0.002 >= min_delta = 0.0001. New best score: 0.089
Metric val_loss improved by 0.001 >= min_delta = 0.0001. New best score: 0.089
Metric val_loss improved by 0.001 >= min_delta = 0.0001. New best score: 0.088
`Trainer.fit` stopped: `max_epochs=80` reached.
wandb: updating run metadata
wandb: 
wandb: Run history:
wandb:                        epoch ▁▁▁▁▂▂▂▂▂▂▃▃▃▃▄▄▄▄▅▅▅▅▅▅▅▆▆▆▆▆▇▇▇▇▇█████
wandb: grad_mean/layer_skip_projs.2 ▁█▁▂▁▂▂▁▁▁▁▁▁▁▁▁▂▁▁▁▂▁▁▁▁▂▂▃▁▂▁▁▂▁▂▁▁▁▂▁
wandb: grad_mean/layer_skip_projs.3 ▂▂▂▂▁▆▂▃▂▁▁▂▂▁▂▂▂▂▁▁▁▄▂▂▂▁█▃▃▂▆▃▆▅▃▁▂▃▁▂
wandb: grad_mean/layer_skip_projs.4 ▂█▁▂▂▁▃▂▁▁▁▂▁▁▁▁▁▁▁▂▁▁▁▂▁▁▁▂▂▂▂▂▂▁▂▂▂▁▁▁
wandb: grad_mean/layer_skip_projs.5 ▃▅▃█▃▃▂▂▂▂▁▃▇▁▁▂▂▃▂▁▁▁▂▂▁▂▃▃▄▃▇▂▂▄▇▂▂▂▂▁
wandb: grad_mean/layer_skip_projs.6 █▂▃▂▂▁▁▁▂▂▂▁▁▂▁▁▁▁▁▁▂▂▂▁▂▁▁▁▁▁▁▁▂▂▁▂▂▁▂▁
wandb: grad_mean/layer_skip_projs.7 █▄▃▄▇▂▂▁▂▁▂▁▁▂▃▂▃▁▂▅▂▂▁▂▂▃▃▂▂▄▂▂▅▃▂▃▃▅▃▄
wandb:       grad_mean/lif_layers.0 ▂▂▁▁▁▁▂▁▂▁▁▅▂▁▁▂▂▃▂▁▂▄▃▃▂▂▂▂▅▄▃▂▅█▂▁▂▂▂▂
wandb:       grad_mean/lif_layers.1 ▁▁▂█▂▁▁▁▁▁▁▁▁▁▁▁▁▁▁▁▁▂▁▁▂▂▃▂▅▄▃▂▃▆▃▃▂▂▁▂
wandb:       grad_mean/lif_layers.2 ▁▂▅▂▁▁▂▂▂▁▁▁▁▁▁▁▁▁▁▂▁▂▁▁▂▄▃▃▄▅█▆▃▂▂▃▂▂▁▁
wandb:                          +18 ...
wandb: 
wandb: Run summary:
wandb:                        epoch 79
wandb: grad_mean/layer_skip_projs.2 7e-05
wandb: grad_mean/layer_skip_projs.3 6e-05
wandb: grad_mean/layer_skip_projs.4 3e-05
wandb: grad_mean/layer_skip_projs.5 8e-05
wandb: grad_mean/layer_skip_projs.6 3e-05
wandb: grad_mean/layer_skip_projs.7 0.00056
wandb:       grad_mean/lif_layers.0 0.00044
wandb:       grad_mean/lif_layers.1 0.0002
wandb:       grad_mean/lif_layers.2 8e-05
wandb:                          +18 ...
wandb: 
wandb: 🚀 View run RSNN_wHypOpt_8L_Skip2_run3 at: https://wandb.ai/lupos/surrogate-confidence/runs/3obe0pd7
wandb: ⭐️ View project at: https://wandb.ai/lupos/surrogate-confidence
wandb: Synced 6 W&B file(s), 0 media file(s), 0 artifact file(s) and 0 other file(s)
wandb: Find logs at: /scratch/ka_rh5993/wandb_logs/wandb/run-20251114_105127-3obe0pd7/logs
2025-11-14 11:42:40,344 INFO: Run 3 finished. Best checkpoint: /pfs/data6/home/ka/ka_itec/ka_rh5993/SpikeSynth/surrogate/models/SRNN/RSNN_wHypOpt_8L_Skip2-runrun_idx=0-epoch=78-val_loss=0.07.ckpt
2025-11-14 11:42:40,344 INFO: === Starting run 4/4 with seed 45 ===
GPU available: False, used: False
TPU available: False, using: 0 TPU cores
HPU available: False, using: 0 HPUs
wandb: setting up run 104ztfvj
wandb: Tracking run with wandb version 0.22.2
wandb: Run data is saved locally in /scratch/ka_rh5993/wandb_logs/wandb/run-20251114_114240-104ztfvj
wandb: Run `wandb offline` to turn off syncing.
wandb: Syncing run RSNN_wHypOpt_8L_Skip2_run4
wandb: ⭐️ View project at https://wandb.ai/lupos/surrogate-confidence
wandb: 🚀 View run at https://wandb.ai/lupos/surrogate-confidence/runs/104ztfvj
/home/ka/ka_itec/ka_rh5993/.local/lib/python3.12/site-packages/pytorch_lightning/callbacks/model_checkpoint.py:751: Checkpoint directory /pfs/data6/home/ka/ka_itec/ka_rh5993/SpikeSynth/surrogate/models/SRNN exists and is not empty.

  | Name             | Type       | Params | Mode 
--------------------------------------------------------
0 | norm             | LayerNorm  | 14     | train
1 | lif_layers       | ModuleList | 62.9 K | train
2 | leaky_linears    | ModuleList | 0      | train
3 | temp_skip_projs  | ModuleList | 0      | train
4 | layer_skip_projs | ModuleList | 25.0 K | train
5 | layer_bntt       | ModuleList | 0      | train
6 | layer_norms      | ModuleList | 0      | train
7 | output_layer     | Linear     | 65     | train
--------------------------------------------------------
55.2 K    Trainable params
32.8 K    Non-trainable params
88.0 K    Total params
0.352     Total estimated model params size (MB)
38        Modules in train mode
0         Modules in eval mode
SLURM auto-requeueing enabled. Setting signal handlers.
Metric val_loss improved. New best score: 0.159
Metric val_loss improved by 0.000 >= min_delta = 0.0001. New best score: 0.159
Metric val_loss improved by 0.004 >= min_delta = 0.0001. New best score: 0.155
Metric val_loss improved by 0.022 >= min_delta = 0.0001. New best score: 0.132
Metric val_loss improved by 0.010 >= min_delta = 0.0001. New best score: 0.122
Metric val_loss improved by 0.005 >= min_delta = 0.0001. New best score: 0.117
Metric val_loss improved by 0.000 >= min_delta = 0.0001. New best score: 0.117
Metric val_loss improved by 0.004 >= min_delta = 0.0001. New best score: 0.113
Metric val_loss improved by 0.001 >= min_delta = 0.0001. New best score: 0.112
Metric val_loss improved by 0.000 >= min_delta = 0.0001. New best score: 0.111
Metric val_loss improved by 0.000 >= min_delta = 0.0001. New best score: 0.111
Metric val_loss improved by 0.000 >= min_delta = 0.0001. New best score: 0.111
Metric val_loss improved by 0.002 >= min_delta = 0.0001. New best score: 0.109
Metric val_loss improved by 0.002 >= min_delta = 0.0001. New best score: 0.106
Metric val_loss improved by 0.002 >= min_delta = 0.0001. New best score: 0.104
Metric val_loss improved by 0.006 >= min_delta = 0.0001. New best score: 0.098
Metric val_loss improved by 0.008 >= min_delta = 0.0001. New best score: 0.091
Metric val_loss improved by 0.004 >= min_delta = 0.0001. New best score: 0.086
Metric val_loss improved by 0.002 >= min_delta = 0.0001. New best score: 0.084
Metric val_loss improved by 0.001 >= min_delta = 0.0001. New best score: 0.084
Metric val_loss improved by 0.001 >= min_delta = 0.0001. New best score: 0.083
Metric val_loss improved by 0.001 >= min_delta = 0.0001. New best score: 0.082
Metric val_loss improved by 0.000 >= min_delta = 0.0001. New best score: 0.082
Metric val_loss improved by 0.001 >= min_delta = 0.0001. New best score: 0.081
Metric val_loss improved by 0.001 >= min_delta = 0.0001. New best score: 0.080
Metric val_loss improved by 0.002 >= min_delta = 0.0001. New best score: 0.078
Metric val_loss improved by 0.000 >= min_delta = 0.0001. New best score: 0.078
Metric val_loss improved by 0.001 >= min_delta = 0.0001. New best score: 0.077
Metric val_loss improved by 0.000 >= min_delta = 0.0001. New best score: 0.077
Metric val_loss improved by 0.000 >= min_delta = 0.0001. New best score: 0.076
Metric val_loss improved by 0.000 >= min_delta = 0.0001. New best score: 0.076
Metric val_loss improved by 0.000 >= min_delta = 0.0001. New best score: 0.076
Metric val_loss improved by 0.000 >= min_delta = 0.0001. New best score: 0.075
Metric val_loss improved by 0.000 >= min_delta = 0.0001. New best score: 0.075
Metric val_loss improved by 0.000 >= min_delta = 0.0001. New best score: 0.075
`Trainer.fit` stopped: `max_epochs=80` reached.
wandb: uploading history steps 277-279, summary, console lines 57-57
wandb: 
wandb: Run history:
wandb:                        epoch ▁▁▁▁▂▂▂▂▂▂▃▃▃▃▃▄▄▄▄▄▄▅▅▅▅▆▆▆▆▆▆▆▇▇▇▇▇███
wandb: grad_mean/layer_skip_projs.2 ▁▁█▁▂▂▂▂▂▆▂▃▃▂▂▃▂▃▂▂▁▃▄▂▄▁▁▂▂▂▂▂▃▂▂▂▁▁▁▂
wandb: grad_mean/layer_skip_projs.3 ▁▁▁▁█▂▆▂▂▁▂▂▄▃▄▂▃▅▇▄▃▂▃▄▆▂▂▃▂▃▁▁▁▂▁▁▁▁▁▁
wandb: grad_mean/layer_skip_projs.4 ▁▁▁▁▅▂▁▂▁▁▁▂█▂▂▂▁▃▂▁▂▁▁▁▁▁▁▁▁▁▁▁▁▁▁▁▁▁▁▁
wandb: grad_mean/layer_skip_projs.5 ▂▁▁▂▅█▂▁▂▁▂▂▁▄▅▂▃▆▅▅▂▃▄▂▂▃▂▂▂▁▁▁▁▁▁▂▁▂▁▁
wandb: grad_mean/layer_skip_projs.6 ▂▁▁▁▂▄▆▇▃▃▂▄▅█▇▂▂▂▂▃▂▃▂▂▄▂▁▂▂▁▁▂▂▂▁▃▃▁▁▁
wandb: grad_mean/layer_skip_projs.7 ▁▂▁▅▂▂▂▁▂▁█▁▂▁▅▃▃▂▂▁▂▁▁▁▂▂▁▁▁▂▁▁▁▁▁▁▁▁▁▁
wandb:       grad_mean/lif_layers.0 ▁▁▁▂▂▃▂▁▃▂▃▂▂▆▆█▅▂▃▂▂▃▃▂▂▂▂▁▁▁▁▁▃▂▂▂▂▁▁▁
wandb:       grad_mean/lif_layers.1 ▁▁▁▁▁▂▂▂▂▂▁▃▂▄▂▄█▄▄▄▂▂▃▂▂▂▂▂▂▂▁▂▁▂▂▂▂▁▁▂
wandb:       grad_mean/lif_layers.2 ▁▃▂▁▃▂▂▂▆▄▆▂▂█▃▂▂▃▂▂▂▃▂▂▃▂▂▁▂▂▁▂▂▂▂▁▁▂▂▂
wandb:                          +18 ...
wandb: 
wandb: Run summary:
wandb:                        epoch 79
wandb: grad_mean/layer_skip_projs.2 4e-05
wandb: grad_mean/layer_skip_projs.3 3e-05
wandb: grad_mean/layer_skip_projs.4 1e-05
wandb: grad_mean/layer_skip_projs.5 3e-05
wandb: grad_mean/layer_skip_projs.6 1e-05
wandb: grad_mean/layer_skip_projs.7 5e-05
wandb:       grad_mean/lif_layers.0 0.00018
wandb:       grad_mean/lif_layers.1 6e-05
wandb:       grad_mean/lif_layers.2 4e-05
wandb:                          +18 ...
wandb: 
wandb: 🚀 View run RSNN_wHypOpt_8L_Skip2_run4 at: https://wandb.ai/lupos/surrogate-confidence/runs/104ztfvj
wandb: ⭐️ View project at: https://wandb.ai/lupos/surrogate-confidence
wandb: Synced 6 W&B file(s), 0 media file(s), 0 artifact file(s) and 0 other file(s)
wandb: Find logs at: /scratch/ka_rh5993/wandb_logs/wandb/run-20251114_114240-104ztfvj/logs
2025-11-14 12:33:32,608 INFO: Run 4 finished. Best checkpoint: /pfs/data6/home/ka/ka_itec/ka_rh5993/SpikeSynth/surrogate/models/SRNN/RSNN_wHypOpt_8L_Skip2-runrun_idx=0-epoch=78-val_loss=0.07.ckpt
